Bài Tình Ca;1
Ca Mừng Thiên Chúa;1
Khúc Hát Mặt Trời;1
Khi Ngoại Giới Chết Rồi;1
Cửa Ơi;1
Chúa Đã Sai Tôi Đi;1
Vua Hiển Vinh;1
Bạn Tình Ta Ơi;1
Hát Lên Bài Ca;1
Vì Lòng Chúa Bao La;1
Con Muốn Trọn Đời;1
Kinh Hòa Bình;1
Nỗi Niềm;1
Lời Con Kêu Khấn;1
Than Sầu Chi Mãi;1
Tiệc Đời Mai;1
Khúc Hát Mặt Trời;1
Tôi Vui Mừng;1
Ai Được Lên Núi Thánh;1
Chúa Là Niềm Vui;1
Cảm Mến Hồng Ân;1
Đối Tượng Duy Nhất;1
Giacaria;1
Vạn Vật Hoan Ca;1
Lạy Thiên Chúa;1
Như Nước Trong Nguồn;1
Bên Hang Đá;1
Mùa Xuân Cứu Thế;1
Mùa Cứu Chuộc Ra Hoa;1
Khắp Trên Khung Trời;1
Noel Về;1
Muôn Lạy Vua Cứu Tinh;1
Giao Duyên;1
Theo Vì Sao Cứu Thế;1
Alleluia;1
Nếu Ngài Thương Con;1
Ngày Về;1
Bài Ca Máu Đỏ;1
Hồn Tôi Ngợi Khen Chúa;1
Kính Chào Nữ Vương;1
